{
    "Contact": [
        "http://www.iagos.org"
    ],
    "DOI": "http://dx.doi.org/10.25326/3",
    "DiscHierarchy": [
        "4.4.1",
        "Geosciences",
        "Atmospheric Sciences"
    ],
    "Discipline": "Atmospheric Sciences",
    "Format": [
        "NetCDF"
    ],
    "Language": [
        "English"
    ],
    "MetaDataAccess": "http://catalogue2.sedoo.fr/geonetwork/srv/eng/csw-iagos?verb=GetRecord&metadataPrefix=oai_dc&identifier=9b3ef7e7-a7f2-555f-9fe6-8536a15d438d",
    "PublicationTimestamp": "2018-09-06T11:59:59Z",
    "PublicationYear": [
        "2018"
    ],
    "Publisher": [
        "IAGOS"
    ],
    "ResourceType": [
        "dataset"
    ],
    "Rights": [
        "restricted"
    ],
    "SpatialCoverage": [
        "180.0 -90.0",
        "-180.0 90.0"
    ],
    "fulltext": "4d3be8dd-c41a-4f35-8ba6-722cf12e2de3;2018-09-06T18:17:38.497+02:00;IAGOS ancillary data (L4) - CO contributions to the aircraft measurements;dataset;Atmospheric conditions;IAGOS;SEDOO;AERIS;climatologyMeteorologyAtmosphere;NetCDF;In order to help analyzing the IAGOS carbon monoxide (CO) observations and understanding the processes driving their evolutions, we provide ancillary parameters calculated with SOFT-IO (Sauvage et al., 2017; http://dx.doi.org/10.25326/2) along aircraft observations.\n\nCO contribution is defined as follow. CO mixing ratio is calculated for each IAGOS observations (every 0.5\u00b0 in latitude or longitude at cruising altitude; every 10hPa during ascent or descent of the plane) and sorted by source origin (biomass burning and anthropogenic origin, and for 14 geographical origins, see Fig.1). CO total contribution is then the sum of each CO source origin or the sum of each CO geographical origin and can be used to interpret IAGOS CO measurements. Some examples are highlighted in Sauvage et al., 2017 for individual flights (their Fig.5 to Fig.8).\n\nCO is calculated so far for different up-to-date emissions inventories (ECCAD and MACCity for anthropogenic emissions; GFED4 and GFAS v1.2 for biomass burning emissions) available in the ECCAD project (http://eccad.aeris-data.fr/) and since the beginning of CO measurements in IAGOS (end of 2001) up to now.\n\nL4 IAGOS CO contributions are available on the IAGOS data portal (http://iagos-data.fr) and are part of the IAGOS ancillary data (http://iagos-data.fr/#L4Place:).They are subject to the IAGOS data protocol (http://iagos-data.fr/#RegisterPlace:);In order to help analyzing the IAGOS carbon monoxide (CO) observations and understanding the processes driving their evolutions, we provide ancillary parameters calculated with SOFT-IO (Sauvage et al., 2017; http://dx.doi.org/10.25326/2) along aircraft observations.\n\nCO contribution is defined as follow. CO mixing ratio is calculated for each IAGOS observations (every 0.5\u00b0 in latitude or longitude at cruising altitude; every 10hPa during ascent or descent of the plane) and sorted by source origin (biomass burning and anthropogenic origin, and for 14 geographical origins, see Fig.1). CO total contribution is then the sum of each CO source origin or the sum of each CO geographical origin and can be used to interpret IAGOS CO measurements. Some examples are highlighted in Sauvage et al., 2017 for individual flights (their Fig.5 to Fig.8).\n\nCO is calculated so far for different up-to-date emissions inventories (ECCAD and MACCity for anthropogenic emissions; GFED4 and GFAS v1.2 for biomass burning emissions) available in the ECCAD project (http://eccad.aeris-data.fr/) and since the beginning of CO measurements in IAGOS (end of 2001) up to now.\n\nL4 IAGOS CO contributions are available on the IAGOS data portal (http://iagos-data.fr) and are part of the IAGOS ancillary data (http://iagos-data.fr/#L4Place:).They are subject to the IAGOS data protocol (http://iagos-data.fr/#RegisterPlace:);restricted;eng;Data produced by the European Research Infrastructure IAGOS.;NetCDF;180.0 -90.0;-180.0 90.0;http://www.iagos.org;http://iagos-data.fr/#CMSConsultPlace:ANCILLARY_DATA;http://dx.doi.org/10.25326/3;http://iagos-data.fr/images/logo_blue.png;http://iagos-data.fr/portal/rest/images/map:global:thumb;http://iagos-data.fr/portal/rest/image/storedById/6871350981954295755",
    "group": "iagos",
    "groups": [
        {
            "name": "iagos"
        }
    ],
    "name": "9b3ef7e7-a7f2-555f-9fe6-8536a15d438d",
    "notes": [
        "In order to help analyzing the IAGOS carbon monoxide (CO) observations and understanding the processes driving their evolutions, we provide ancillary parameters calculated with SOFT-IO (Sauvage et al., 2017; http://dx.doi.org/10.25326/2) along aircraft observations.\n\nCO contribution is defined as follow. CO mixing ratio is calculated for each IAGOS observations (every 0.5\u00b0 in latitude or longitude at cruising altitude; every 10hPa during ascent or descent of the plane) and sorted by source origin (biomass burning and anthropogenic origin, and for 14 geographical origins, see Fig.1). CO total contribution is then the sum of each CO source origin or the sum of each CO geographical origin and can be used to interpret IAGOS CO measurements. Some examples are highlighted in Sauvage et al., 2017 for individual flights (their Fig.5 to Fig.8).\n\nCO is calculated so far for different up-to-date emissions inventories (ECCAD and MACCity for anthropogenic emissions; GFED4 and GFAS v1.2 for biomass burning emissions) available in the ECCAD project (http://eccad.aeris-data.fr/) and since the beginning of CO measurements in IAGOS (end of 2001) up to now.\n\nL4 IAGOS CO contributions are available on the IAGOS data portal (http://iagos-data.fr) and are part of the IAGOS ancillary data (http://iagos-data.fr/#L4Place:).They are subject to the IAGOS data protocol (http://iagos-data.fr/#RegisterPlace:)"
    ],
    "oai_identifier": [
        "9b3ef7e7-a7f2-555f-9fe6-8536a15d438d"
    ],
    "oai_set": "",
    "state": "active",
    "tags": [
        {
            "name": "Atmospheric"
        },
        {
            "name": "conditions"
        },
        {
            "name": "IAGOS"
        },
        {
            "name": "SEDOO"
        },
        {
            "name": "AERIS"
        },
        {
            "name": "climatologyMeteorologyAtmosphere"
        }
    ],
    "title": [
        "IAGOS ancillary data (L4) - CO contributions to the aircraft measurements"
    ],
    "url": "http://iagos-data.fr/portal/rest/image/storedById/6871350981954295755"
}